URL,article_text,title,author,source,published_date
https://www.reuters.com/world/africa/al-shabaab-captures-strategic-somalia-town-it-presses-offensive-2025-04-16/,,,,,
https://news.afp.com/#/c/main/actu/articles?id=newsml.afp.com.20250416T170321Z.doc-42k93np&type=news,"Okay, I'm ready! 

Please paste the article text here and I'll do my best to extract the main body content. I'll look for the longest continuous text block that seems to be the central topic of the piece. 

Let's get started! 🌳  
",AFP News,,AFP News,04/16/2025 17:03
https://news.afp.com/#/c/main/actu/articles?id=newsml.afp.com.20250416T124946Z.doc-42hy9kd&type=news,"Please provide me with the article text! I'm ready to identify and remove the extraneous content, leaving you with the core article body.  

Just paste the text here, and I'll do my best to isolate the main article. 

",AFP News,,Agence France-Presse (AFP) News,04/16/2025 12:49:46
https://news.afp.com/#/c/main/actu/articles?id=newsml.afp.com.20250416T120226Z.doc-42hp89d&type=news,"Okay, I'm ready!  Please paste the article text and I will do my best to isolate the main content.  

I'll look for the longest continuous block of text that seems to relate to a single topic.  

Let me know if you have any specific criteria for what you consider ""extraneous"" content at the top or bottom. For example, do you want me to remove things like:

* Header information
* Navigation menus
* ""Related Articles"" sections
* Footers 
* Advertising


The more information you give me, the better I can tailor my output to your needs.  

",AFP News,,AFP News,04/16/2025 12:02:26 PM
https://news.afp.com/#/c/main/actu/articles?id=newsml.afp.com.20250416T124402Z.doc-42j46g2&type=news,"I understand!  

Please paste the article text here. I will identify the main article body and return it to you, removing any extraneous content at the top and bottom. 

I'll do my best to accurately determine the main article, but if there are multiple lengthy sections on different topics, please let me know which one you want me to focus on.  

",AFP News,Unknown,AFP News,04/16/2024 12:44
https://news.afp.com/#/c/main/actu/articles?id=newsml.afp.com.20250416T140936Z.doc-42jh2cp&type=news,"Okay, I understand. 

Give me the article text and I will identify and remove the extraneous content, leaving only the main body of the article. 

I'll do my best to accurately determine which section is the primary article content.  Please note that if there are multiple sections of similar length on related topics, I might need some clarification from you to determine which one you consider the main article. 

",AFP News,,AFP News,04/16/2024 14:09
https://apnews.com/article/iran-us-nuclear-talks-iaea-zarif-tehran-c3a8afc699c670300b9521f1e2019ef7,"Iranconfirmed Wednesday that thenext round of nuclear talks with the United States this weekendwill be held in Rome after earlier confusion over where the negotiations would be held.

The announcement by Iranian state television came as Iran’s PresidentMasoud Pezeshkianformally approved the resignation of one of his vice presidents who served as Tehran’s key negotiator in its 2015 nuclear deal with world powers.

The head of the United Nations’ nuclear watchdog, Rafael Mariano Grossi of the International Atomic Energy Agency, also arrived in the Islamic Republic on Wednesday. His talks may includenegotiations over just what access the IAEA inspectors can getunder any proposed deal.

The state TV announcement said Oman will again mediate the talks on Saturday in Rome. Oman’s foreign minister served as an interlocutor between the two sides at talks last weekend in Muscat, the sultanate’s capital.

Officials initially on Monday identified Rome as hosting the negotiations, only forIran to insist early Tuesday they would return to Oman. American officials so far haven’t said publicly where the talks will be held, though Trump did callOman’s Sultan Haitham bin Tariqon Tuesday, while the ruler was on a trip to the Netherlands.

The stakes of the negotiations couldn’t be higher for the two nationsclosing in on half a century of enmity. U.S. President Donald Trump repeatedly has threatenedto unleash airstrikestargeting Iran’s nuclear program if a deal isn’t reached. Iranian officialsincreasingly warn that they could pursue a nuclear weaponwith their stockpile of uranium enriched to near weapons-grade levels.


The former vice president, Mohammad Javad Zarif, served as a key supporter of Pezeshkian in his election last year but drew criticism from hard-liners within Iran’s Shiite theocracy, who long have alleged Zarif gave away too much in negotiations.

In March,Zarif tendered his resignation to Pezeshkian. However, the president did not immediately respond to the letter. Zarif hasused resignation announcements in the pastin his political career as leverage, including in a dispute last year over the composition of Pezeshkian’s Cabinet. The president had rejected that resignation.

But on late Tuesday, a statement from the presidency said Pezeshkian wrote Zarif a letter praising him but accepting his resignation.

“Pezeshkian emphasized that due to certain issues, his administration can no longer benefit from Zarif’s valuable knowledge and expertise,” a statement from the presidency said.

The president in a decree appointed Mohsen Ismaili, 59, to be his new vice president for strategic affairs. In Iran’s political system, the president has multiple vice presidents. Ismaili is known as a political moderate and a legal expert.

Grossi arrived in Tehran for meetings with Pezeshkian and others. He met Wednesday night with Iran’s Foreign Minister Abbas Araghchi, writing on the social platform X after the meeting: “Cooperation with (the IAEA) is indispensable to provide credible assurances about the peaceful nature of Iran’s nuclear programme at a time when diplomacy is urgently needed.”

Iran’s state-run IRNA news agency described Araghchi as briefing Grossi on the first round of talks with the U.S., while also urging the IAEA to “adopt a clear and transparent stance regarding threats against Iran’s peaceful nuclear facilities.” Both Israel and the U.S. have threatened to attack Iran’s nuclear sites if a deal can’t be reached to limit Tehran’s program.

“As variety of spoilers are gathered to derail current negotiations, we need a Director General of Peace,” Araghchi wrote on X. “Our predisposition is to trust Grossi in mission to keep the Agency away from politics and politicization, and to retain focus on its technical mandate.”

Since the nuclear deal’s collapse in 2018 with Trump’s unilateral withdraw of the U.S. from the accord, Iran has abandoned all limits on its program, and enriches uranium to up to 60% purity — near weapons-grade levels of 90%.

Surveillance cameras installed by the IAEA have been disrupted, while Iran has barred some of theVienna-based agency’s most experienced inspectors. Iranian officials also have increasingly threatened that they could pursue atomic weapons, something the West and the IAEA have been worried about for years since Tehran abandoned an organized weapons program in 2003.

Any possible deal between Iran and the U.S. likely would need to rely on the IAEA’s expertise to ensure Tehran’s compliance. And despite tensions between Iran and the agency, its access has not been entirely revoked.

Meanwhile, Araghchi on Wednesday warned the U.S. about taking contradictory stances in the talks.

That likely refers to comments from U.S. Mideast envoy Steve Witkoff, who this week initially suggested a deal could see Iran go back to 3.67% uranium enrichment — like in the 2015 deal reached by the Obama administration. Witkoff then followed up with saying “a deal with Iran will only be completed if it is a Trump deal.”

“Iran must stop and eliminate its nuclear enrichment and weaponization program,” he wrote on X. “It is imperative for the world that we create a tough, fair deal that will endure, and that is what President Trump has asked me to do.”

Araghchi warned America about taking any “contradictory and opposing stances” in the talks.

“What is certain is that Iran’s enrichment (program) is a real, accepted matter,” he said. “We are prepared to build trust and address any potential concerns, but the core issue of enrichment itself is not negotiable.”








",Iran confirms 2nd round of Iran-US nuclear talks will be in Rome | AP News,"Karimi, Amir Vahdat",AP News,04/16/2025 00:00
https://www.washingtonpost.com/world/2025/04/16/russia-ukraine-expiration-energy-ceasefire/,,,,,
,,,,,
,,,,,
,,,,,
https://www.bloomberg.com/news/articles/2025-04-16/russia-seeks-to-buy-boeing-jets-with-frozen-assets-after-ukraine-ceasefire,"Russia has asked the US to let it buyBoeing Co.aircraft using money from billions of dollars in frozen state assets once there’s a ceasefire in Ukraine, according to a person in Moscow familiar with the matter.

While the request isn’t a condition of agreeing to a truce, Russia understands that frozen funds can’t be used to buy the jets without a ceasefire being in place, the person said, asking not to be identified discussing internal matters. A deal allowing the purchase of jets could form part of an easing of sanctions in the event there’s a halt to the fighting. 
",Russia Seeks to Buy Boeing Jets with Frozen Assets After Ukraine Ceasefire,,Bloomberg,04/16/2025
https://www.bbc.com/news/articles/cvg7pqzk47zo,"## Supreme Court backs 'biological' definition of woman

Judges at the UK Supreme Court have unanimously ruled that a woman is defined by biological sex under equalities law.

It marks the culmination of a long-running legal battle which could have major implications for how sex-based rights apply across Scotland, England and Wales.

The court sided with campaign group For Women Scotland, which brought a case against the Scottish government arguing that sex-based protections should only apply to people that are born female.

Judge Lord Hodge said the ruling should not be seen as a triumph of one side over the other, and stressed that the law still gives protection against discrimination to transgender people.

Lord Hodge said the central question was how the words ""woman"" and ""sex"" are defined in the legislation.

He told the court: ""The unanimous decision of this court is that the terms woman and sex in the Equality Act 2010 refer to a biological woman and biological sex.

""But we counsel against reading this judgement as a triumph of one or more groups in our society at the expense of another, it is not.""

He added that the legislation gives transgender people ""protection, not only against discrimination through the protected characteristic of gender reassignment, but also against direct discrimination, indirect discrimination and harassment in substance in their acquired gender"".

Campaigners who brought the case against the Scottish government hugged each other and punched the air as they left the courtroom, with several of them in tears.

The Scottish government argued in court that transgender people with a gender recognition certificate (GRC) are entitled to the same sex-based protections as biological women.

The Supreme Court was asked to decide on the proper interpretation of the 2010 Equality Act, which applies across Britain.

For Women Scotland argued for a ""common sense"" interpretation of the words man and woman, telling the court that sex is an ""immutable biological state"".

Speaking outside the Supreme Court following the ruling, For Women Scotland co-founder Susan Smith said: ""Today the judges have said what we always believed to be the case, that women are protected by their biological sex.

""Sex is real and women can now feel safe that services and spaces designated for women are for women and we are enormously grateful to the Supreme Court for this ruling.""

First Minister John Swinney said the Scottish government accepted the judgement.

Heposted on social media: ""The ruling gives clarity between two relevant pieces of legislation passed at Westminster.

""We will now engage on the implications of the ruling.""

Swinney added: ""Protecting the rights of all will underpin our actions.""

A Scottish government spokesperson insisted ministers had acted ""in good faith"" during the legal proceedings, and noted that the Equality and Human Rights Commission was updating its guidance in response to the judgement.

A UK government spokesman said the ruling would bring ""clarity and confidence for women and service providers such as hospitals, refuges, and sports clubs"".

""Single-sex spaces are protected in law and will always be protected by this government,"" the spokesman added.

Conservative leader Kemi Badenochdescribed the rulingas a ""victory for all of the women who faced personal abuse or lost their jobs for stating the obvious"".

She added: ""It's important to be reminded the court strongly and clearly re-affirmed the Equality Act protects all trans people against discrimination, based on gender reassignment, and will continue to do so.""

The case follows years of heated debate over transgender and women's rights, including controversy overtransgender rapist Isla Bryson initially being put in a women's prisonand an ongoing employment tribunal involving a female NHS Fife nurse whoobjected to a transgender doctor using a women's changing room.


The judges ruled that interpreting sex as ""certificated"" rather than ""biological"" would ""cut across the definitions of man and ""woman and thus the protected characteristic of sex in an incoherent way"".

They said a ""certified"" definition of sex would weaken protections for lesbians, citing the example of lesbian-only spaces and associations as it would mean that a trans woman who was attracted to women would be classed as a lesbian.

The ruling found the biological interpretation of sex was also required for single-sex spaces to ""function coherently"".

It cited changing rooms, hostels, medical services and single-sex higher education institutions.

The judges noted ""similar confusion and impracticability"" had arisen in relation to single-sex associations and charities, women's sport, public sector equality and the armed forces.

The judges added: ""The practical problems that arise under a certificated sex approach are clear indicators that this interpretation is not correct.""


Gender reassignment is a protected characteristic in law, making it is illegal to discriminate against someone on the basis that they are transgender.

However, single-sex spaces can exclude people with GRCs ""if it is proportionate to do so"".

Dr Nick McKerrell, senior law lecturer at Glasgow Caledonian University, said the ruling means a transgender women with a GRC who was excluded from a single-sex space would be unable to argue she is being discriminated against as a woman.

He also said the ruling implied that workplaces would need to provide separate spaces for people on the basis of biological sex.

But the law lecturer said arguments over access to single-sex spaces would not be ""settled"" by this court case.

He told the BBC: ""It doesn't mean everything overnight is going to change in terms of stopping trans people from accessing services. It will depend on what providers think the new definition will mean for them.""

Dr McKerrell said the judgement does not immediately change anything for the rules on transgender participation in women's sport, but that it might prompt a ""reassessment"" of rules.

The legal dispute began in 2018, when the Scottish Parliament passed a bill designed to ensure gender balance on public sector boards.

For Women Scotland complained that ministers had included transgender people as part of the quotas in that law.

The issue has been contested several times in the Scottish courts.

Holyrood ministers won the most recent case in Scotland, with judge Lady Haldane ruling in 2022 that the definition of sex was ""not limited to biological or birth sex"".

The Scottish Parliament passed reforms that year that would have made it easier for someone to change their legally recognised sex.

The move was blocked by the UK government, and has since been dropped by Holyrood ministers.




",Supreme Court backs 'biological' definition of woman,Unknown Author,BBC,01/27/2023 08:31
https://www.jpost.com/breaking-news/article-850289,"Israel shifts Gaza aid to private sector, backtracks on Gaza aid provision, Katz confirms 

Defense Minister Israel Katzon Wednesday confirmed that Israel is close to backtracking on a vow not to allow the provision of more humanitarian aid to Gaza before the Israeli hostages are returned and that aid could be restarted soon, though private companies would be used to circumvent Hamas. 
Katz’s admission follows a flurry of leaks in recent weeks that Israel would need to restore the flow of aid to Gaza soon if no new ceasefire deal is reached, given that it has been cut off for around six weeks.
Israel had initially said it would permanently cut off aid and that there were no international law questions at stake, given the excess food that Hamashad obtained during the 40-day-plus ceasefire from January 19 to early March. The defense minister’s statement acknowledged the reality that without restoring aid soon, Israel could run into new questions of alleged starvation. In contrast, if it restores aid soon, given that many estimates said that Hamas had enough food for at least around three months, the IDF could avoid new claims of attempted starvation by Israel against the Gazan population.

Trucks containing humanitarian aid from Jordan and international communities transfers into the northern Gaza Strip, October 22, 2024 (credit: IDF SPOKESMAN’S UNIT)

However, Katz’s statement left many questions unclear. While he referenced private companies for handing out food to Gaza’s population, which he said would sideline Hamas as the party distributing food aid, he did not provide names or details. 
This is not the first time that Israel has tried to cut Hamas out of the food aid distribution chain. 
As early as January 2024, then-defense minister Yoav Gallant tried to initiate such a program in northern Gaza for the direct provision of food to Palestinian civilians without Hamas’s intervention, but the program was never workable and faced pushback within the government from hard-right ministers Betzalel Smotrich and Itamar Ben-Gvir.
Eventually, Israel tried to use the World Food Program and the World Central Kitchen to replace UNRWA for handing out aid, but each organization, at one point or another, withdrew due to being mistakenly struck by IDF forces. 
Even when the organizations returned, they either distributed the food directly to Hamas, or the terror group seized it from whoever it was given to. It is unclear how private contractors would have large enough and powerful enough armed forces to distribute food aid to over two million Palestinians throughout Gaza on a daily basis and would be able to stay in the field long enough to ensure that Hamas did not take it at some point.
Seemingly to try to dilute the admission and preempt attacks from Smotrich and Ben-Gvir, Katz buried the food aid admission in a longer statement about crushing Hamas, regaining all of the hostages, and threatening a wider war. Likewise, Katz claimed that Egypt is pressuring Hamas to give up its weapons, though the terror group has made it clear that such a condition is a non-starter. According to Israeli intelligence, Hamas has also rebuilt and is back up to 20,000-25,000 fighters.
IDF sources said there is still no concrete plan to engage new private contractors to distribute food aid to Gaza. Ben-Gvir responded to Katz’s statement in a post on X/Twitter, noting, “It’s a shame that we don’t learn from mistakes.”
“As long as our hostages are languishing in the tunnels, there is no reason for a single grain of food or any aid to enter Gaza. Halting the aid is one of the central pressure points on Hamas, and returning it before Hamas is on its knees and has released all our hostages would be a historic mistake.
“I will do everything in my power to ensure that this historic mistake does not happen, and I call on the prime minister and the defense minister not to take this foolish step, which would harm our ability to defeat Hamas and safely bring all our hostages home,” Ben-Gvir wrote.

Following Ben-Gvir’s latest criticism of Katz for acknowledging that food aid to Gaza may resume in the future, the defense minister released a bizarre statement in which he said repeatedly that food aid would not be restored at this time, but contrastingly that it would be restored in the future.






 


The article is heavily editorialized, riddled with grammatical errors, and  seems to mostly quote  political figures rather than providing a factual news piece. This text feels like a draft and is filled in with filler text and confusion. 



The IDF does need some work



","Israel shifts Gaza aid to private sector, backtracks on Gaza aid provision, Katz confirms",,The Jerusalem Post,03/13/2024
